skill,tech_level_required,specialization_required,description,defaults,difficulty,attribute,modifiers
Accounting,,,"This is the ability to keep books of account, to examine the condition of a business, etc. A successful Accounting roll (requires at least two hours of study, and possibly months to audit a large corporation) can tell you whether financial records are correct, and possibly reveal evidence of forgery, tampering, and similar criminal activity.","IQ-6, Finance-4, Mathematics (Statistics)-5, or Merchant-5",Hard,Intelligence,The time modifiers under Time Spent (p. 346) often apply; the Talents (p. 89) of Business Acumen and Mathematical Ability both provide a bonus.
Acrobatics,,,"This is the ability to perform gymnastic stunts, roll, take falls, etc. This can be handy on an adventure, as tightrope walking, human pyramids, and trapeze swinging all have useful applications. Each trick requires a separate skill roll, at whatever penalties the GM sees fit. If you are performing stunts on a moving vehicle or mount, roll against the lower of Acrobatics and the appropriate Driving or Riding skill. 

You may substitute an Acrobatics roll for a DX roll in any attempt to jump, roll, avoid falling down, etc. As well, you may attempt an Acrobatic Dodge in combat – a jump or roll that avoids an attack in a flashy way (see Acrobatic Dodge, p. 375). Finally, a successful Acrobatics roll will reduce the effective distance of any fall by five yards (see Falling, p. 431).

Acrobatics, Aerobatics, and Aquabatics default to one another at -4. Add +1 to these three skills if you have Perfect Balance (p. 74).","DX-6, Aerobatics-4, Aquabatics-4",Hard,Dexterity,
Acting,,,"This is the ability to counterfeit moods, emotions, and voices, and to lie convincingly over a period of time. A successful Acting roll lets you pretend to feel something that you do not. The GM may also require an Acting roll whenever you try to fool someone, play dead in combat, etc. 

Impersonation is a special type of acting. To impersonate someone, you must first successfully disguise yourself (see Disguise, p. 187) – unless your victims cannot see you! 

Note that Acting is not the same Fast-Talk (the art of the “quick con”) or Performance (the skill of screen and stage acting).","IQ-5, Performance-2, or Public Speaking-5",Average,Intelligence,"+1 for every point of IQ you have over the person you are trying to fool (or the smartest one in the group), or -1 for every point of difference if your victim is smarter than you; -3 for Low Empathy (p. 142); -1 to -4 for Shyness (p. 154); -5 for Truthfulness (p. 159), but only if you are trying to deceive someone. For impersonation only: -5 if you are not well acquainted with your subject; -5 if those you wish to fool are acquaintances of the subject (-10 for close acquaintances)."
Administration,,,"This is the skill of running a large organization. It is often a prerequisite for high Rank (p. 29). A successful Administration roll gives you a +2 reaction bonus when dealing with a bureaucrat, and allows you to predict the best way to go about dealing with a bureaucracy.",IQ-5 or Merchant-3,Average,Intelligence,
Aerobatics,,,"The ability to execute tight turns, loops, power dives, etc. in flight. You must be able to fly to learn this skill – although how you fly (magic, wings, jet pack, etc.) is irrelevant. Natural fliers might find flight to be as effortless as humans find walking, but they must still learn Aerobatics in order to engage in complex acrobatics. Add +2 to skill if you have 3D Spatial Sense (p. 34).

Acrobatics, Aerobatics, and Aquabatics default to one another at -4. Add +1 to these three skills if you have Perfect Balance (p. 74).
","DX-6, Acrobatics-4, Aquabatics-4",Hard,Dexterity,
Airshipman,TRUE,,"The skill of handling ballast, gas valves, mooring lines, etc. on a blimp, zeppelin, or other large airship. 

This is the ability to serve as crew aboard a specific type of large vehicle. It includes familiarity with “shipboard life,” knowledge of safety measures, and training in damage control (the use of emergency equipment to control flooding, fight fires, patch the hull, and so forth). Make a skill roll for basic map or chart reading, practical meteorology, or to recall laws and regulations that pertain to your vehicle. 

This skill also lets you steer the vessel. It is easier than Piloting, Submarine, and similar skills because it only includes knowledge of how to steer. Specialists handle such activities as plotting courses and operating sensors. These experts report to the captain, who in turn tells you how to maneuver. Make a DX-based skill roll whenever you take the helm – but note that your effective skill cannot exceed your captain’s Shiphandling skill (p. 220). 

The average Airshipman skill of an entire crew can be used as a measure of overall crew quality. The GM rolls against average skill whenever the vehicle arrives or departs, in unfavorable conditions, or in battle. Failure and critical failure results depend on the circumstances. ",IQ-4,Easy,Intelligence,
Alchemy,TRUE,,"This is the study of magical transformations and transmutations. In a magical game world, an alchemist would be able to identify concoctions with magical effects (“elixirs”), such as love potions and healing unguents, and prepare them from suitable ingredients. This is a mechanical process, using the mana inherent in certain things; therefore, those without Magery can learn and use Alchemy, and Magery confers no benefit.",None.,Very Hard,Intelligence,
Animal Handling,,TRUE,"This is the ability to train and work with animals. You must specialize in a category of animals – the more intelligent the animals, the narrower the category. Examples of interest to adventurers: Big Cats (jaguars, lions, tigers, etc.), Dogs, Equines (horses and donkeys), and Raptors (eagles, falcons, and hawks). The default between specialties is -2 within the same order (e.g., Dogs to Big Cats), -4 across orders (e.g., Dogs to Equines), and -6 for larger differences (e.g., Dogs to Raptors). 

To train an animal, make an Animal Handling roll once per day of training. A failed roll means the animal learned nothing; a badly failed roll means you are attacked. The time it takes to train an animal depends on the beast’s intelligence and tractability (see Chapter 16). 

When working with a trained animal, roll against skill for each task you set the animal. This roll is at -5 if the animal is not familiar with you, -5 if the circumstances are stressful to the animal, and -3 or more if the task is a complex one. To put on an entertaining circus act, snake-charming show, etc., you must make a separate Performance roll! 

This skill can also (sometimes) be used to quiet a wild, dangerous, or untrained animal. This roll is at -5 if the creature is wild or very frightened, or -10 if it is a man-eater or man-killer. 

Finally, this skill gives an advantage in combat against animals within your specialty. If you have Animal Handling at level 15, an animal’s attack and defense rolls are at -1 against you, because you can predict its behavior. At skill 20, the animal’s rolls are at -2.",IQ-5,Average,Intelligence,
Anthropology,,TRUE,"This is the science of evolution and culture. An anthropologist is knowledgeable in the ways of primitive (and not-so-primitive) societies. An Anthropology roll might explain, or even predict, unusual rituals and folk customs. This skill requires specialization by species (if left unspecified, assume the anthropologist’s own species). Specialties usually default to one another at -2 to -5, although there may be no default for completely alien species.","IQ-6, Paleontology (Paleoanthropology)-2, or Sociology-3",Hard,Intelligence,
Aquabatics,,,"The ability to engage in underwater acrobatics. Prerequisites: Swimming, or the Amphibious advantage (p. 40) or the Aquatic disadvantage (p. 145). 

Acrobatics, Aerobatics, and Aquabatics default to one another at -4. Add +1 to these three skills if you have Perfect Balance (p. 74).","DX-6, Acrobatics-4, Aerobatics-4",Hard,Dexterity,
Archeology,,,"This is the study of ancient civilizations. An archaeologist is at home with excavations, old potsherds, inscriptions, etc. An Archaeology roll lets you answer questions about ancient history, or identify artifacts and dead languages. It might even reveal information relating to the occult; e.g., Ancient Secrets and Things Man Was Not Meant To Know . . .",IQ-6,Hard,Intelligence,
Architecture,,,"This is the ability to design buildings, and to deduce the design of buildings from their function (and vice versa). A successful Architecture roll lets you learn things about a strange building, find a secret room or door, etc. ","IQ-5, Engineer(Civil)-4",Average,Intelligence,-2 if the building is of a strange type; -5 if it is alien.
Area Knowledge,,TRUE,"* You have an IQ default only for Area Knowledge of a place where you live or once lived. Geography only gives a default for Area Knowledge of the specialty region. 

This skill represents familiarity with the people, places, and politics of a given region. You usually have Area Knowledge only for the area you consider your “home base,” whether that’s a single farm or a solar system. If information about other areas is available, the GM may allow you to learn additional Area Knowledge skills. 

The GM should not require Area Knowledge rolls for ordinary situations; e.g., to find the blacksmith, tavern, or your own home. But he could require a roll to locate a smith to shoe your horse at 3 a.m., or to find the best ambush spot along a stretch of road. “Secret” or obscure information might give a penalty, require a Hidden Lore skill (p. 199), or simply be unavailable – GM’s decision. For instance, Area Knowledge of Washington, D.C. gives you the location of the Russian Embassy, but not the KGB’s current safe house. 

The information covered by Area Knowledge often overlaps such skills as Current Affairs, Geography, Naturalist, and Streetwise. The difference is that Area Knowledge works for a single area: you know the habits of this tiger or gang boss, but have no special insight into tigers or gangs in general. 

You can learn Area Knowledge for any sort of area. The larger the territory, the less “personal” and more general your knowledge becomes. Almost everyone will have Area Knowledge of some type. The “canonical” area classes are: 

Neighborhood: For an urban area: the residents and buildings of a few city blocks. For a rural area: the inhabitants, trails, streams, hiding places, ambush sites, flora, and fauna of a few hundred acres. 

Village or Town: All important citizens and businesses, and most unimportant ones; all public buildings and most houses. 

City: All important businesses, streets, citizens, leaders, etc. 

Barony, County, Duchy, or Small Nation: General nature of its settlements and towns, political allegiances, leaders, and most citizens of Status 5+. 

Large Nation: Location of its major cities and important sites; awareness of its major customs, ethnic groups, and languages (but not necessarily expertise); names of folk of Status 6+; and a general understanding of the economic and political situation. 

Planet: As for a large nation, but more general; knowledge of people of Status 7+ only. 

Interplanetary State: Location of major planets; familiarity with all known races (but not necessarily expertise); knowledge of people of Status 7+; general understanding of the economic and political situation. 

Galaxy: Location of the capitals of interplanetary states and the homeworlds of major races; general awareness of all major races; knowledge of individuals of Status 8; general understanding of relations between interplanetary states. 

Area Knowledge for anything larger than a galaxy would be meaninglessly vague. 

Your IQ-4 default applies to any of these classes, as long as you have lived in the area. Defaults are limited by “common knowledge” at your tech level! A TL0 hunter would have a default for every level up to “Village or Town,” while a TL8 student would have defaults up to “Planet” level. You must live in an interplanetary or interstellar state to have defaults for levels above “Planet.” 

In some game worlds, Area Knowledge specialties may exist for parallel realities and other dimensions – Area Knowledge (Cyberspace), Area Knowledge (Dream Realms), etc. The knowledge such skills provide is left to the GM’s judgment.


Distance 
For an area far from your “stomping grounds,” use the penalties under Long-Distance Modifiers (p. 241). However, the speed at which knowledge propagates increases as progressively more powerful tools for managing information appear: printing press, telephone, television, computers, faster-than-light radio, etc. To reflect this, at TL5 and above, the GM may choose to roll 3d against TL+1 (e.g., 9 or less at TL8) to determine whether you are familiar with the distant region from TV, the Internet, etc. On a success, you may ignore all distance penalties. (The GM might also wish to use this rule to determine whether a character’s Reputation is known far from home in a high-tech setting.)

Area Class 
“Area classes” are defined under Area Knowledge skill: Neighborhood; Village or Town; City; Barony, County, Duchy, or Small Nation; Large Nation; Planet; Interplanetary State; and Galaxy. Area class becomes important in campaigns that involve a lot of travel. We assume here that the smaller areas are contained within the larger ones. 

If you have specialized in a larger area and want information about a smaller area within it, the penalty is -2 for one class of difference, -4 for two, -8 for three, and so on, doubling each time. 

If you have specialized in a smaller area and want information about a specific locale within the larger area containing it, the most appropriate solution is usually to use the distance penalties described above. However, questions having to do with the entire large area use a flat -2 per difference in levels. 

Example: Someone with Area Knowledge (Earth) would be at -8 – due to three classes of difference – to know the mayor of Los Angeles. However, someone with Area Knowledge (Los Angeles) would be at -4 to know the location of Mount Rushmore. The same person would be at -10 to know the location of the Library of Congress in Washington, D.C.; the Library of Congress has more to do with Washington than with the United States as a whole, and it’s more appropriate to resolve the question by considering distance. 

Note that in a setting with multiple planes of existence, Area Knowledge skills for one reality can be dangerously unreliable in another. The GM decides the penalty that he will apply when you try to apply your knowledge of your San Francisco to his version.
","IQ-4*, Geography(Regional)-3",Easy,Intelligence,
Armoury,TRUE,,"This is the ability to build, modify, and repair a specific class of weapons or armor. (It does not include skill at design; for that, see Engineer, p. 190.) A successful roll lets you find a problem, if it isn’t obvious; a second roll lets you repair it. Time required is up to the GM. 

You must specialize in one of the following fields: 

Battlesuits: All kinds of powered armor, along with any built-in weaponry. 

Body Armor: Any kind of unpowered personal armor (but not shields). Also defaults to Smith (Bronze)-3 at TL1, to Smith (Iron)-3 at TL2-4, and to Machinist-3 at TL5+. 

Force Shields: Any kind of force screen or deflector – be it personal or vehicular. This is the same skill as Electronics Repair (Force Shields). 

Heavy Weapons: All weapons used with the Artillery and Gunner skills. 

Melee Weapons: Any weapon used with a Melee Weapon or Thrown Weapon skill, as well as all kinds of shields. Also defaults to Smith (Bronze)-3 at TL1, to Smith (Iron)-3 at TL2-4, and to Machinist-3 at TL5+. 

Missile Weapons: Man-portable, pre-gunpowder projectile weapons of all kinds – bows, crossbows, slings, etc. 

Small Arms: All weapons used with the Beam Weapons and Guns skills. Also defaults to Machinist-5 at TL5+. 

Vehicular Armor: All kinds of armored vehicle hulls. 

Most specialties default to one another at -4 – but above TL4, there is no default between Armoury specialties dealing with armor and Armoury specialties dealing with weapons. The technologies covered by each specialty vary with TL. For instance, Armoury (Small Arms) covers black-powder small arms at TL4, repeating small arms that fire cartridges at TL6, “smart” infantry weapons at TL8, and portable beam weapons at TL10. 

The GM should strictly enforce penalties for unfamiliarity. Armoury/TL10 (Small Arms) might cover both beam weapons and portable railguns, but going from one to the other gives you -2 to skill until you familiarize yourself with all the differences.
","IQ-5, Engineer(Same Specialization)-4",Average,Intelligence,"-2 for an unfamiliar item within your specialty (e.g., plate armor when you’re used to mail); equipment modifiers (p. 345)."
Artillery,TRUE,,"This is the ability to use a heavy weapon, such as a trebuchet or a howitzer, for indirect fire – that is, to put fire onto a target area via a high ballistic arc or similar path. For direct fire, use Gunner skill (p. 198). Roll against Artillery skill to bombard the target. 

Loaders can make ST-based Artillery rolls to improve the rate of fire of certain crew-served heavy weapons. See the appropriate weapon description for details. 

You must specialize by weapon type. The available specialties vary by TL, but include one or more of: 

Beams: Any kind of heavy energy weapon that is fired from orbit, bounced off a mirror, or otherwise used against targets you cannot see. 

Bombs: All kinds of unpowered, free-falling munitions. 

Cannon: Any kind of heavy projectile weapon – bombard, howitzer, naval gun, etc. 

Catapult: Any kind of indirect-fire mechanical siege engine, such as a trebuchet. Guided Missile: Any kind of seeking or remotely piloted missile. 

Torpedoes: Any kind of powered underwater projectile. 

There is no default between specialties, some of which (e.g., Torpedoes) cover weapons that bear little or no resemblance to true artillery. Artillery is a single skill only because all the weapons it covers use the same rules.

The weapons covered by each specialty will vary by TL. For instance, Artillery (Cannon) would cover primitive bombards at TL3, brass cannon at TL4, breech-loading howitzers at TL6, and orbital railguns at TL9+. 

Familiarity is crucial here! Artillery (Cannon) covers both 81mm infantry mortars and 406mm naval guns, but going from one to the other will give -2 for weapon type (81mm vs. 406mm), -2 for fire-control (visual spotting vs. fire-direction center), and -2 for mount (bipod vs. naval turret), for a total of -6 to skill until you familiarize yourself with all the differences.

Note that Forward Observer skill (p. 196) is generally required to designate targets for Artillery skill. ",IQ-5,Average,Intelligence,"All relevant combat modifiers; -2 for an unfamiliar firecontrol system (e.g., map coordinates when you’re used to satellite imagery) or mount (e.g., a naval turret when you’re used to emplaced guns), or for an unfamiliar weapon of a known type (e.g., 155mm when you are used to 203mm); -4 or more for a weapon in bad repair."
Artist,,TRUE,"This skill represents talent at a visual art. A successful roll might let you create a recognizable likeness of a person or an object, or a work beautiful enough to sell (the GM should not allow a default roll for this use!). Time required is up to the GM. 

Artist is based on IQ, but there are many situations in which the GM could logically ask for a DX-based roll, in which case modifiers for High Manual Dexterity (p. 59) or HamFisted (p. 138) would apply. In rare cases, even a ST-based Artist roll might make sense – for instance, to work with a physically tough material. 

You must specialize in an art form. Common specialties include: 

Body Art: Tattooing, piercing, and scarification. Both this specialty and Painting suffice for henna or temporary tattoos, but cosmetic surgery requires Surgery skill (p. 223). 

Calligraphy: Beautiful and decorative handwriting. You need not be literate! 

Drawing: All forms of charcoal, ink, pastel, and pencil work. 

Illumination: Decorating written text with miniature paintings and pictures. 

Illusion: Creating believable or evocative illusions. Prerequisite: magical or psionic illusion ability of some kind. 

Interior Decorating: Creating pleasing building interiors by selecting appropriate paints, fixtures, and furniture. Default: Architecture-3. 

Painting: All forms of painting, whether on paper, canvas, or a wall, and whether with tempera, oil-based paint, or something more exotic (like blood). 

Pottery: Working with various sorts of ceramics – especially clay. 

Scene Design: Designing sets for the stage. Default: Architecture-3. 

Sculpting: Creating three-dimensional art from ivory, stone, metal, etc. 

Woodworking: All forms of fine woodwork, including cabinet-making and decorative carving. Default: Carpentry-3. 

Calligraphy, Drawing, Illumination, and Painting default to one another at -2, and to or from Body Art at -4. Interior Decorating, Scene Design, and Woodworking default among themselves at -4. All other Artist specialties default to one another at -6. 

An artist of any kind can take a further optional specialty (p. 169) in a particular medium or technique. 

Many Artist specialties are used to earn a living rather than to create fine art, and some people regard them as “craft” skills, not “art” skills. It is up to you whether you focus on beauty, realism, or functionality. ",IQ-6,Hard,Intelligence,"Equipment modifiers (p. 345); -2 if the medium is unfamiliar (e.g., tempera when you are used to oils); -5 if the medium is difficult (e.g., marble, for a sculptor)."
Astronomy,TRUE,,"This is the study of stars and other extraplanetary objects. An astronomer could answer questions about the Sun, the planets of the solar system, etc. An amateur who can locate stars and use a telescope, but not perform involved calculations, has an optional specialty (p. 169): Astronomy (Observational). This specialty does not require Mathematics as a prerequisite.",IQ-6. Prerequisite: Mathematics(Applied),Hard,Intelligence,
Autohypnosis,,,"This skill allows you to tap reserves of inner strength by entering a trancelike state. It requires a concentration period of (20 - skill) seconds, minimum one second. You cannot talk or move during the initiation of the trance state. A successful skill roll allows you to do one of the following: 

Improve Concentration. You get +2 to skill to perform a specific, lengthy mental task (e.g., break a code or write a computer program), but -2 to all unrelated IQ, Perception, and skill rolls. The task must be a relatively sedate one, done in a quiet place (library, lab, monastery, or placid wilderness). 

Increase Will. You get +2 to Will (+5 on a critical success) for one hour. This applies to all attempts to resist interrogation, torture, or magical or psionic attack. This roll is at -2. 

Negate Pain/Fatigue. Cancels the negative effects of being reduced to less than 1/3 of your FP or HP (but not the fatigue or injury itself). This roll is at -4, and you may only make one attempt per hour.",Meditation-4,Hard,Willpower,
Axe/Mace,,,"Any shorter medium-length, one-handed impact weapon, such as an axe, hatchet, knobbed club, or pick.

An impact weapon is any rigid, unbalanced weapon with most of its mass concentrated in the head. Such a weapon cannot parry if you have already attacked with it on your turn.","DX-5, Flail-4, Two-Handed Axe/Mace-3.",Average,Dexterity,
Battlesuit,TRUE,,"This is training in the use of a specific class of protective suit. Suits designed to shield the wearer from environmental or battlefield hazards frequently incorporate gadgets (such as autoinjectors and sensors) and life-support equipment. Some suits even contain motors to enhance ST or Move. As a result, you do not merely wear such gear – you operate it. 

Roll against Environment Suit skill to get into or out of your suit quickly. A successful roll halves the time required. To activate a specific subsystem of a suit, or to gauge whether a suit is in good repair, make an IQ-based skill roll instead. 

When rolling against DX or any DX-based skill while suited up, use the lower of your Environment Suit skill and your actual skill level. For instance, if you have DX 14, Stealth15, and Vacc Suit-13, you will function at DX 13 and Stealth-13 while wearing a spacesuit. Particularly ungainly suits might give -1 or more to DX on top of this, regardless of skill level. On the other hand, some sleek, ultra-tech suits might not limit skills at all! 

Battlesuit/TL: All kinds of powered battle armor and exoskeletons. Battle armor and exoskeletons are similar but not identical. If you only have experience with one, you are at -2 to operate the other until you gain familiarity (see Familiarity, p. 169). ","DX-5, NBC Suit-2, Vacc Suit-2, Diving Suit-4. ",Average,Dexterity,
