skill,tech_level_required,specialization_required,description,defaults,difficulty,attribute,modifiers
Judo,,,"This skill represents any advanced training at unarmed throws and grapples – not just the eponymous Japanese martial art. 

Judo allows you to parry two different attacks per turn, one with each hand. Your Parry score is (skill/2) + 3, rounded down. This parry is not at the usual -3 for parrying a weapon barehanded, greatly reducing the likelihood of injury when you defend against an armed foe. In addition, Judo gives an improved retreating bonus when you parry; see Retreat (p. 377). For complete rules for parrying barehanded, see Parrying Unarmed (p. 376). 

On the turn immediately after a successful Judo parry, you may attempt to throw your attacker if he is within one yard. This counts as an attack; roll vs. Judo skill to hit. (Note that in an All-Out Attack, you cannot attempt two throws, but you can make one attempt at +4.) Your foe may use any active defense – he can parry your hand with a weapon! If his defense fails, you throw him. 

When you throw a foe, he falls where you please. On a battle map, he lands in any two hexes near you. One of these hexes must be his starting hex, your hex, or any hex adjacent to one of those hexes. Your victim must roll against HT; a failed roll means he is stunned! If you throw him into someone else, that person must roll against the higher of ST+3 or DX+3 to avoid being knocked down. 

Finally, you may use your Judo skill instead of your DX for any DX roll made in close combat except to draw a weapon or drop a shield. If you grapple a foe using Judo, and he fails to break free, you may make a Judo attack to throw him on your next turn, exactly as if you had parried his attack. 

To use Judo, any hand with which you wish to parry or grapple must be empty. Because Judo relies heavily on footwork, all Judo rolls and Judo parries take a penalty equal to your encumbrance level. For instance, Heavy encumbrance would give you -3 to hit or to parry an enemy attack.",None.,Hard,Dexterity,
Jumping,,,"This skill represents trained jumping ability. When you attempt a difficult jump, roll against the higher of Jumping or DX. In addition, you may use half your Jumping skill (round down) instead of Basic Move when calculating jumping distance. For instance, Jumping-14 would let you jump if you had Basic Move 7. See Jumping (p. 352).",None.,Easy,Dexterity,
Karate,,,"This skill represents any advanced training at unarmed striking, not just the Okinawan martial art of karate. Roll against Karate to hit with a punch (at no -4 for the “off” hand), or Karate-2 to hit with a kick. You cannot use Karate to attack with claws, teeth, etc., or with a blackjack – use Brawling (p. 182) for that. Karate skill does let you make several special attacks, however; see Special Unarmed Combat Techniques (p. 403). 

Karate improves damage: if you know Karate at DX level, add +1 per die to basic thrust damage when you calculate damage with Karate attacks: punches, kicks, elbow strikes, etc. Add +2 per die if you know Karate at DX+1 or better! Work out damage ahead of time and record it on your character sheet. 

Karate allows you to parry two different attacks per turn, one with each hand. Your Parry score is (skill/2) + 3, rounded down. This parry is not at the usual -3 for parrying a weapon barehanded, greatly reducing the likelihood of injury when you defend against an armed foe. In addition, Karate gives an improved retreating bonus when you parry; see Retreat (p. 377). For more on parrying barehanded, see Parrying Unarmed (p. 376). 

To use Karate, any hand with which you wish to strike or parry must be empty (but you are free to wear heavy gauntlets, brass knuckles, etc. to increase damage). Because Karate relies heavily on footwork, all Karate attacks and parries take a penalty equal to your encumbrance level. For instance, Heavy encumbrance would give you -3 to hit or to parry an enemy attack.",None.,Hard,Dexterity,
Kiai,,,"You can channel your chi outward in a mighty shout (kiai) that freezes lesser foes. This counts as an attack, and costs 1 FP per attempt, successful or not. 

Roll a Quick Contest: your Kiai skill vs. your target’s Will. You are at -1 for every full two yards of distance. Your victim resists at +1 if he is Hard of Hearing, at +2 if Deaf! If you win, your target is mentally stunned (see Effects of Stun, p. 420). 

This skill only works against a single victim; everyone can hear the shout, but your chi is focused on that one foe. However, a successful Kiai roll gives you +2 to Intimidation rolls vs. everyone within earshot.",None. Prerequisites: Trained By A Master or Weapon Master.,Hard,Health,
Knife,,,"Any rigid, hilted blade less than one foot long, from a pocketknife to a bowie knife. A knife 208 SKILLS has a very small parrying surface, which gives you -1 to your Parry score.","Force Sword-3, MainGauche-3, or Shortsword-3.",Easy,Dexterity,
Knot-Tying,,,"This is the ability to tie a wide variety of knots quickly and efficiently. A successful skill roll lets you make a noose, tie someone up, etc. If you bind someone using this skill, he must win a Quick Contest of Escape vs. your Knot-Tying skill to free himself. ","DX-4, Climbing-4, or Seamanship-4. ",Easy,Dexterity,"+1 per level of High Manual Dexterity (p. 59), or -3 per level of Ham-Fisted (p. 138)."
Kusari,,,"A weighted chain wielded in two hands. 

A whip is a flexible weapon made from a length of chain, leather, wire, etc. A whip can be up to seven yards long – but note that a whip two yards or more in length cannot strike at one yard or closer, and is slow to ready after an attack. A whip tends to wind around its target, making it an excellent disarming and entangling weapon. However, a whip’s lack of rigidity makes it a poor parrying weapon. For details, see Special Melee Weapon Rules (p. 404). ","Two-Handed Flail-4, Force Whip-3, Monowire Whip-3, Whip-3.",Hard,Dexterity,
Lance,,,"The ability to use the lance: a long, spear-like weapon wielded from horseback. This is not a Melee Weapon skill (see p. 208). You may not use a lance to parry – you must block or dodge enemy attacks.",DX-5 or Spear-3. Prerequisite: Riding. ,Average,Dexterity,
Lasso,,,"This is the skill of throwing the lariat: a long rope or thong with a sliding noose at one end. Its intended purpose is to snare animals, but it can also entangle opponents in combat – see Special Ranged Weapons (p. 410).",None.,Average,Dexterity,
Law,,TRUE,"This skill represents knowledge of law codes and jurisprudence. A successful roll lets you remember, deduce, or figure out the answer to a question about the law. Few legal questions have clear-cut answers, however – even an expert will hedge his advice! 

You must specialize. There are two general classes of specialty: 

• The laws of a particular political region (e.g., Canada or France) within a specific field (constitutional, contract, criminal, police, etc.). Examples: Law (British Criminal), Law (Canadian Constitutional), and Law (U.S. Contract). 

• A specialized body of law not associated with a political region. Examples: Law (Catholic Canon), Law (International), and Law (Space). 

Specialties within the same region, such as Law (British Criminal) and Law (British Police), or field, such as Law (British Criminal) and Law (French Criminal), default to one another at -4. If both region and field differ, the default is -6 or worse. 

In some times and places, a Quick Contest of Law (Criminal) between the defense and prosecution will determine the outcome of a trial. In others, Law functions as an Influence skill (see Influence Rolls, p. 359) used to sway the rulings of the judge. 

Law enforcers nearly always have a point or two in Law (Police) for their region. This represents knowledge of “proper procedure” when it comes to arrests, evidence handling, interrogation, etc.",IQ-6,Hard,Intelligence,
Leadership,,,"This is the ability to coordinate a group. Make a Leadership roll to lead NPCs into a dangerous or stressful situation. (PCs can decide for themselves if they want to follow you!) 

You may attempt a Leadership roll in combat if you spend your turn doing nothing but giving orders and encouragement. On a success, everyone on your side who can hear you (including PCs) has +1 on all combat-related Fright Checks and morale checks, and on self-control rolls for disadvantages that would reduce combat efficiency (such as Berserk and Cowardice – or Bloodlust, if you wish to take prisoners). A critical success gives +2. The bonus lasts until your next turn, at which time you may roll again. A group can have only one leader, however! If multiple people attempt Leadership rolls, no one gets a bonus. 

Note that a minimum level of Leadership is often a prerequisite for high Rank (p. 29). ",IQ-5,Average,Intelligence,"Any bonus for Charisma (p. 41); -3 for Low Empathy (p. 142); -1 to -4 for Shyness (p. 154). -5 if the NPCs have never been in action with you; -5 if you are sending them into danger but not going yourself; +5 if their loyalty to you is “Good”; +10 if their loyalty is “Very Good.” If their loyalty is “Excellent,” you do not have to roll!"
Leatherworking,,,"This is the ability to work with leather to make belts, saddles, armor, etc. A successful skill roll lets you repair or create leather goods. Make an IQ-based roll to design items that are more artistic than functional. ",DX-4,Easy,Dexterity,"Equipment modifiers (p. 345); +1 per level of High Manual Dexterity (p. 59), or -3 per level of Ham-Fisted (p. 138)."
Lifting,,,"This is the trained ability to use your strength to its best advantage when you lift. Roll once per lift. On a success, increase your Basic Lift by 5% per point by which you made your roll. This has no effect on encumbrance, or on how much you can carry. See Lifting and Moving Things (p. 353).",None.,Average,Health,
Light Walk,,,"This skill allows you to exert very little pressure when you walk. On a successful Light Walk roll, you leave no visible tracks. Tracking rolls to follow you automatically fail unless they rely on something more than sight; thus, a human tracker would be baffled, but bloodhounds would suffer no penalty at all. 

You can also attempt to walk over fragile surfaces without falling through. Maximum Move under such circumstances is 1/3 normal (GM’s decision). Thin ice would require an unmodified Light Walk roll, while rice paper would require a roll at -8! 

Finally, a successful Light Walk roll can give a bonus to Stealth when your intention is to move quietly. This bonus equals half your margin of success, rounded down. Minimum bonus is +1.","None. Prerequisites: Trained By A Master, and both Acrobatics and Stealth at 14+.",Hard,Dexterity,
Linguistics,,,"This is the study of the principles upon which languages are based. A successful skill roll lets you identify a language from a snatch of speech or writing. As well, make a skill roll once per month when learning a language without a teacher. On a success, you learn at full speed rather than at 1/4 speed (see Learning Languages, p. 25).",None.,Hard,Intelligence,
Lip Reading,,,"This is the ability to see what others are saying. You must be within seven yards, or have some means of bringing your point of view this close. A successful skill roll lets you make out one sentence of a discussion – assuming, of course, that you know the language. If your subjects suspect that you can read lips, they can hide their mouths or subvocalize to thwart you. A critical failure on a Lip Reading roll – if you are where your victims could see you – means that you stared so much you were noticed! ",Perception-10,Average,Perception,"All Vision modifiers (see Vision, p. 358)."
Liquid Projector,TRUE,TRUE,"This is the ability to use a weapon that projects a stream of liquid or gas. Roll against Liquid Projector skill to hit your target. 

Make an IQ-based Liquid Projector roll to take immediate action (e.g., patch a leak), should your weapon fail. 

You must specialize by weapon type: 

Flamethrower: Any weapon that projects burning liquid or gas. (This does not include plasma weapons, which are often called “flamers”; use Beam Weapons skill for those.) 

Sprayer: Any weapon that emits a gas or atomized liquid (nerve gas, sleeping gas, etc.), including an ordinary spray can used as an improvised weapon. 

Squirt Gun: Any weapon that fires a low-pressure stream of liquid at the rate of one squirt per pull of the trigger. 

Water Cannon: Any weapon that fires a continuous jet of high-pressure liquid, usually but not always water, with the intent of causing knockback. 

These specialties default to one another at -4. The weapons covered by each specialty vary by TL; e.g., Liquid Projector (Flamethrower) covers fire-siphons loaded with Greek fire at TL4, while at TL6, it covers backpack tanks that project thickened fuel. ",DX-4,Easy,Dexterity,"All applicable ranged combat modifiers; -2 for heavy weapons when you are used to portable weapons (e.g., a flamethrower mounted on a tank when you are used to a backpack model), or for an unfamiliar weapon of a known type; -4 or more for a weapon in bad repair."
Literature,,,"This is the study of the great writings. A student of literature would be knowledgeable in the realms of old poetry, dusty tomes, criticism, etc. This can be useful for finding clues to hidden treasure, sunken lands, Ancient Secrets, and the like. The work in question must be available in a language you read. ",IQ-6,Hard,Intelligence,"-5 if you’re illiterate (see Literacy, p. 24) and relying on oral tradition, save in pre-literate cultures, where this is the norm."
Lockpicking,TRUE,,"This is the ability to open locks without the key or combination. Each attempt requires one minute. If you make the roll and open the lock, each point by which you succeeded shaves five seconds off the required time. (Safecracking and similar challenges can take more time, at the GM’s discretion.) 

Note that if the lock has a trap or alarm attached, you must make a separate Traps roll to circumvent it.",IQ-5,Average,Intelligence,"Equipment modifiers (p. 345); -5 if working by touch (e.g., in total darkness). Inside information gives a bonus at GM’s discretion. If the GM requires a DX-based roll (for instance, to work with a particularly delicate mechanism), modifiers for High Manual Dexterity (p. 59) or Ham-Fisted (p. 138) will apply."
Machinist,TRUE,,"This is the skill of making and modifying mechanical parts and tools. A successful skill roll lets you build parts from raw materials, manufacture tools for use with another skill (such as Armoury or Lockpicking), or modify any simple mechanical device not explicitly covered by another skill. The GM may require an inventor to make one or more Machinist rolls before attempting an Engineer roll to assemble a gadget. 

Materials and component size vary significantly with tech level. A TL5 machinist works mainly with brass and steel components that can be seen with the naked eye; a TL10 machinist might work with carbon nanotubes. ",IQ-5 or Mechanic(any)-5.,Average,Intelligence,Equipment modifiers (p. 345).
Main-Gauche,,,"Any weapon normally wielded with Knife or Jitte/Sai skill (see below), used in the “off” hand. With this skill, you may ignore the penalty for using the “off” hand on defense (attacks are still at -4) and the -1 for parrying with a knife. To wield a knife as a primary weapon, use Knife skill. 

Fencing weapons are light, onehanded weapons, usually hilted blades, optimized for parrying. If you have a fencing weapon, you get an improved retreating bonus when you parry – see Retreat (p. 377). Furthermore, you have half the usual penalty for parrying more than once with the same hand (see Parrying, p. 376). 

Note that fencing weapons are light and likely to break when used to parry a heavier weapon. They cannot parry flail weapons at all! You must be relatively mobile to capitalize on their speed and maneuverability: all attacks and parries take a penalty equal to your encumbrance level (e.g., Heavy encumbrance gives -3 to hit or to parry). ","DX-4, Jitte/Sai-4 or Knife-4, Rapier-3, Saber-3, Smallsword-3.",Average,Dexterity,
Makeup,TRUE,,"This is the skill of using theatrical makeup to enhance a performer’s appearance. It is not just the ability to make someone look “pretty” – you can make yourself or others look older, younger, or of a different race or nationality. At TL6+, you can use prosthetics to further enhance the effect. However, you cannot make someone look taller or shorter than he actually is.",IQ-4 or Disguise-2. ,Easy,Intelligence,
Market Analysis,,,"This is the skill of predicting the short-term behavior of bond, stock, and currency markets – usually in order to make money! It is the main job skill of professional traders and speculators. Make a skill roll to determine current market trends. On a critical success, you also learn whether a trend will continue or reverse in the future. On a failure, you get no clear answer. On a critical failure, you guess wrong.","IQ-6, Economics-5, or Merchant-4. ",Hard,Intelligence,The Talents (p. 89) of Business Acumen and Mathematical Ability both provide a bonus.
Masonry,,,This is the ability to build things out of brick or stone. ,IQ-4,Easy,Intelligence,"Equipment modifiers (p. 345); -3 for simple engineering (erecting scaffolding, moving large blocks of stone, etc.) rather than masonry per se."
Mathematics,TRUE,TRUE,"This is the scientific study of quantities and magnitudes, and their relationships and attributes, through the use of numbers and symbols. You must specialize: 

Applied: The branch of mathematics that interacts directly with the physical sciences and engineering, dealing with mathematical models of the behavior of physical systems. Defaults: Engineer (any)-5 or Physics-5. 

Computer Science: The theoretical study of data structures and computation. Roll vs. skill to answer questions about what is possible with computers. This gives you no special ability to use computers! Default: Computer Programming-5. 

Cryptology: The mathematical study of codes and ciphers. This gives you a theoretical understanding of encryption schemes, including how they change with TL and why some schemes are more effective than others. To create or break codes, use Cryptography skill (p. 186). Default: Cryptography-5. 

Pure: Generic “academic” mathematics. Make a skill roll to answer any math-related question not covered by another specialty. Pure mathematics encompasses dozens of obscure subfields that will never affect the game. If you must be an expert in something like “non-self-adjoint operator algebras,” you may further note an optional specialty (p. 169). 

Statistics: The science of assembling and analyzing data for the purpose of calculating probabilities, constructing models, and making forecasts. Roll vs. skill to determine the odds of a particular outcome, given sufficient data about similar situations in the past. 

Surveying: The science of determining the area of a portion of the Earth’s surface, the lengths and directions of the bounding lines, and the contour of the surface. Make a skill roll to determine the dimensions of any area you can see. More complex determinations require specialized equipment. Defaults: Cartography-3 or Navigation (any)-4. 

These specialties default to one another at -5.",IQ-6 and others.,Hard,Intelligence,
Mechanic,TRUE,TRUE,"This is the ability to diagnose and fix ordinary mechanical problems. A successful skill roll will let you find or repair one problem. 

You must pick a specialty from within one of these four categories: 

Machine Type: Any one class of nonvehicular machine. Types include Micromachines (miniature machinery, invisible to the naked eye; TL9+), Nanomachines (molecular-scale machinery; TL10+), and Robotics (robots and automated factories; TL7+). 

Motive System Type: Any one type of propulsion system, regardless of vehicle type. Types include Legged, Tracked, Wheeled, Rockets, and Reactionless Thrusters. 

Power Plant Type: Any one type of power plant, no matter what it powers. Types include Clockwork, Steam Engine, Gasoline Engine, Diesel Engine, Gas Turbine, Fuel Cell, Fission Reactor, Fusion Reactor, and Antimatter Reactor. 

Vehicle Type: The controls, hull, motive system, power plant, transmission, and even the paint job of one specific type of vehicle listed under a vehicle-operation skill such as Driving (p. 188), Piloting (p. 214), or Submarine (p. 223). 

Mechanic specialties default to one another at -4, although the GM may modify this for particularly close or distant specialties. The systems covered by each specialty vary by TL. For instance, Mechanic (Light Airplane) covers single-engine biplanes at early TL6, small private jets at TL7, and so forth. 

Familiarity is very important here. For instance, Mechanic/TL7 (Light Airplane) covers both propeller-powered seaplanes and small private jets, but going from one to the other gives you -2 for an unfamiliar item (prop-powered plane to jet) and -2 for an unfamiliar implementation (seaplane to regular plane), for a net -4 to skill until you familiarize yourself with all the differences. ","IQ-5, Engineer (same)-4, or Machinist-5. ",Average,Intelligence,"-2 for an unfamiliar item within your specialty (e.g., a barge when you’re used to battleships), or for an unfamiliar implementation (e.g., a powerboat engine when you’re used to automobile engines); equipment modifiers (p. 345)."
Meditation,,,"This is the ability to calm the emotions, control the mind, and relax the body. To use this skill, you must concentrate for (20 - skill) seconds, minimum one second, and then roll vs. skill. On a success, you enter a trancelike state, which you can maintain for hours. 

A meditative trance is required for certain rituals and is a common preparation for prayer. In addition, the GM may permit you to meditate on a particular moral dilemma. On a successful Meditation roll, the GM will “enlighten” you, providing a hint as to which course of action “feels” right.",Will-6 or Autohypnosis-4. ,Hard,Willpower,
