skill,tech_level_required,specialization_required,description,defaults,difficulty,attribute,modifiers
Professional Skill,,,"Many realistic job skills are more useful for making a living than for adventuring. Most such skills do not appear in this skill list – but you can still learn them if you want! Each is a separate Professional Skill. If your “adventuring” skills aren’t useful for earning money, a Professional Skill can help you earn a steady income. To qualify for most jobs, you will need the relevant Professional Skill at 12+ (unless you are supposed to be incompetent!).

Most professions encompass a body of knowledge. The associated Professional Skills are IQ/Average and default to IQ-5, because the smarter you are, the better you can recall and employ the techniques used at your job. Examples include air traffic controller, barber, brewer, cooper, distiller, dyer, florist, game designer, journalist, prostitute, tanner, vintner, and zookeeper. 

A few professions – glassblower, tailor, weaver, etc. – focus more on precision than on recall. These Professional Skills are DX/Average and default to DX-5. 

At the GM’s option, a given Professional Skill might also default to other skills. For instance, “Journalist” would logically default to Writing-3. 

The skills associated with highly paid or respected professions often have prerequisites. For instance, “Air Traffic Controller” might require Electronics Operation (Sensors) skill. Like defaults, prerequisites are up to the GM. 

You are free to create your own Professional Skills, subject to GM approval. They should be unique and well defined, not just a compilation of existing skills. For example: 

Bartender 
IQ/Average 

Defaults: IQ-5 or Carousing-3. 

This is the skill of maintaining a professional-quality bar and interacting with customers in a professional yet friendly way. A successful skill roll lets you mix drinks, recall local laws regarding alcohol, gauge the intoxication level of a customer, or calm an unruly drunk before the bouncer needs to get involved. At higher levels, this skill takes on an element of showmanship, allowing you to present drinks in unique and attractive ways, and to mix them with showy tricks and flourishes.",Special,Average,DX or IQ,
Propaganda,TRUE,,"This is the skill of indirect persuasion through the media. It is used for psychological warfare by intelligence and military organizations, and for advertising and marketing in the civilian world. Use familiarity (p. 169) to reflect the differences between these areas. 

Propaganda works on groups, not individuals. The GM should set the effective Will of the target group based on its size, composition, and resistance to the desired outcome, and then use the Influence Rolls (p. 359) rules to determine the results. Success might inform the target audience or even alter its perceptions. Propaganda attempts nearly always take more time and exposure than ordinary Influence rolls, however; how much time is up to the GM.","IQ-5, Merchant-5, or Psychology-4. ",Average,Intelligence,
Prospecting,TRUE,,"This is the skill of finding valuable minerals. A successful Prospecting roll lets you locate minerals, judge good ore from a small sample (and gauge its commercial value), and find water by using an “eye for country,” as described for Survival skill (p. 223). 

This skill is “applied geology,” and requires on-site examination. Prospecting from a distance – using maps, instrument readings, and extrapolation – uses Geology skill instead. ",IQ-5 or Geology (any)-4.,Average,Intelligence,"Equipment modifiers (p. 345); -1 in a new area of a familiar type, or -2 or more in an unfamiliar type of area, until you have been there for at least a month."
Psychology,,,"This is the skill of applied psychology, which may be learned by academic study or lengthy observation of human nature. Roll against skill to predict the general behavior of an individual or small group in a particular situation – especially a stressful situation. 

In settings with multiple sapient species, you must specialize by race. Defaults between specialties are up to the GM. 

If the GM desires extra detail, he may rule that Psychology is split into two specialties: Applied (described above) and Experimental (for scientists who run rats in mazes and so forth). Applied defaults to Experimental-5; Experimental does not default to Applied, as a shrewd observer of people may lack training in scientific procedures. ",IQ-6 or Sociology-4.,Hard,Intelligence,"+3 if you know the subject well; +3 if the subject is of a known deviant personality type; +1 for Sensitive or +3 for Empathy (p. 51), or -3 for Low Empathy (p. 142), if diagnosing a subject in your presence; -3 for Callous (p. 125), unless specifically rolling to deduce someone’s weaknesses so you can exploit them."
Public Speaking,,,"This is general talent with the spoken word. A successful skill roll lets you (for instance) give a good political speech, entertain a group around a campfire, incite or calm a riot, or put on a successful “court jester” act. 

Public Speaking includes skill with debate, oratory, and rhetoric, as well as ability with less formal activities such as “punning” and storytelling. Not all speakers possess talent in all of these areas. You may take an optional specialty (p. 169) to represent this. ","IQ-5, Acting-5, Performance-2, or Politics-5. ",Average,Intelligence,Any bonus for Charisma (p. 41); +2 for Voice (p. 97); -1 to -4 for Shyness (p. 154); -2 for Stuttering (p. 157); Cultural Familiarity modifiers (p. 23); Language modifiers (p. 24).
Push,,,"This skill allows you to channel your chi in order to “gently” push away an adversary or cause him to lose his balance. Roll against Push skill to hit. This counts as a barehanded attack (see Shove, p. 372), and your target may attempt any legal active defense. 

If you hit, use the higher of your ST or your Push skill as your effective ST. Roll swing damage for that ST, and double the result. For instance, if you had ST 10 and Push-15, you would roll swing damage for ST 15 (2d+1), and double it. This damage inflicts knockback (see Knockback, p. 378) but never actual physical injury.",None. Prerequisite: Trained By A Master. ,Hard,Dexterity,
Rapier,,,"Any long (over 1 yard), light thrusting sword. 

Fencing weapons are light, onehanded weapons, usually hilted blades, optimized for parrying. If you have a fencing weapon, you get an improved retreating bonus when you parry – see Retreat (p. 377). Furthermore, you have half the usual penalty for parrying more than once with the same hand (see Parrying, p. 376). 

Note that fencing weapons are light and likely to break when used to parry a heavier weapon. They cannot parry flail weapons at all! You must be relatively mobile to capitalize on their speed and maneuverability: all attacks and parries take a penalty equal to your encumbrance level (e.g., Heavy encumbrance gives -3 to hit or to parry). ","DX-5, Broadsword-4, Main-Gauche-3, Saber-3, Smallsword-3.",Average,Dexterity,
Religious Ritual,,TRUE,"This is the ability to perform religious rites – masses, funerals, weddings, etc. – before a congregation. You must specialize by religion. This skill includes detailed knowledge of the ritual motions, prayers, and trappings of the faith, as well as the ability to capture and hold the attention of worshipers. For religions that practice sacrifice, Religious Ritual also covers familiarity with sacrificial tools and methods. 

To be a priest or holy man at TL1+, you must have both Religious Ritual and Theology skill (p. 226) for your religion. TL0 shamans need only learn Religious Ritual. 

In worlds where priests can perform miracles, each magical ritual or spell is a separate skill, but certain “mundane” religious rituals – such as sacrifice – can give bonuses to spell rolls. You must always make a successful Religious Ritual roll to claim such a bonus. In other settings, a priest’s magic is only as good as his ritual. If this is the case, your roll to work magic is against the lower of Religious Ritual and your actual spell skill.",Ritual Magic (same)-6 or Theology (same)-4. ,Hard,Intelligence,
Research,TRUE,,"This is the ability to do library and file research. Roll against skill to find a useful piece of data in an appropriate place of research . . . if the information is there to be found. 

At the GM’s option, when researching material connected with a “book-learned” skill such as Forensics, Literature, or Physics, you may roll against that skill at -2 instead, if that would be better than your Research skill or default (but this is not a general default level). ","IQ-5 or Writing-3. Prerequisite: literacy in at least one language (see p. 24)*. 
* At TL8+, Computer Operation is also a prerequisite. ",Average,Intelligence,"Language modifiers (p. 24), for research materials in a foreign tongue."
Riding,,TRUE,"This is the ability to ride a particular kind of mount. Make a skill roll when you first try to mount a riding animal, and again each time something happens to frighten or challenge the creature (e.g., a jump). 

You must specialize by riding beast. Defaults between specialties vary from 0 to -10. For instance, if you have Riding (Horse), Riding (Mule) is essentially the same skill (no default penalty), Riding (Camel) would default at -3, Riding (Dolphin) at -6, and Riding (Dragon) at a whopping -10! ",DX-5 or Animal Handling (same)-3. ,Average,Dexterity,+5 if the animal knows and likes you; +1 or more for a mount with the Mount skill (p. 210); -10 if the animal has not been trained for riding.
Ritual Magic,,TRUE,"This skill gives an understanding of the intellectual and mystical processes involved in the rituals of a particular tradition of spirit invocation. Make a skill roll to determine the purpose of a ritual conducted in your presence, the type of entity being summoned, etc. 

You must specialize by tradition; e.g., Voodoo or Witchcraft. Specialties default to one another at -5. The processes involved are comparable, but the specific rituals and spirits differ significantly.

In worlds with working ritual magic, Ritual Magic skill is the primary skill of sorcerers. All rituals of power default to it! See the appropriate worldbook for details. 

This is the skill of invoking spirits to produce magical effects for nonreligious reasons. The equivalent skill for the more direct, flashy magic of fantasy is Thaumatology (p. 225); knowledge of religious rites associated with a tradition is Religious Ritual (p. 217).",Religious Ritual(same)-6,Very Hard,Intelligence,
Running,,,"This skill represents training in both sprints and long-distance running. Roll against the higher of Running or HT to avoid fatigue or injury due to running. When racing someone of equal Move on foot, roll a Quick Contest of Running skill to determine the winner. Note that you must have legs and be capable of land movement to learn this skill.",HT-5,Average,Health,
Saber,,,"Any light cut-and-thrust sword. Note that cavalry sabers are quite heavy, and use Broadsword instead. 

Fencing weapons are light, onehanded weapons, usually hilted blades, optimized for parrying. If you have a fencing weapon, you get an improved retreating bonus when you parry – see Retreat (p. 377). Furthermore, you have half the usual penalty for parrying more than once with the same hand (see Parrying, p. 376). 

Note that fencing weapons are light and likely to break when used to parry a heavier weapon. They cannot parry flail weapons at all! You must be relatively mobile to capitalize on their speed and maneuverability: all attacks and parries take a penalty equal to your encumbrance level (e.g., Heavy encumbrance gives -3 to hit or to parry). ","DX-5, Broadsword-4 or Shortsword-4, Main-Gauche-3, Rapier-3, Smallsword-3.",Average,Dexterity,
Savoir-Faire,,TRUE,"This is the skill of appropriate behavior in a subculture that has an established code of conduct – for instance, high society or the military. When dealing with that social group, a successful skill roll lets you interact without embarrassing yourself, detect pretenders to high standing, and so on. You may also substitute an Influence roll against Savoir-Faire for any reaction roll required in a social situation involving that subculture; see Influence Rolls (p. 359). Roll once per encounter. 

You must specialize. Common specialties include: 

Dojo: How to greet masters, wear weapons, and issue challenges at a karate dojo, kung fu kwoon, fencing salle, or similar academy of the martial arts. Recognized skill determines relative standing. In certain places and times, to flout tradition is to risk violent retribution! For competitive martial arts (only), this skill defaults to any relevant Games skill at -3. 

High Society: The manners of those of “good” birth and breeding. Status determines relative standing. Roll against skill whenever you must impersonate someone more than three Status levels away from your own. If your Status is negative and you are trying to pass yourself off as someone of Status 1+, or vice versa, this roll is at -2. 

Mafia: Proper conduct within a formal criminal organization. This includes such things as codes of silence and showing proper deference to “made men.” These protocols often ape those of high society . . . but the penalties for misconduct are far more severe. Default: Streetwise-3. 

Military: The customs, traditions, and regulations of military service. This also includes knowledge of the unwritten rules: what is acceptable even if not regulation, and what is forbidden although there is nothing in writing against it. Military Rank determines relative standing. 

Police: As Savoir-Faire (Military), but for civilian police service. This gives knowledge of the social protocols for police officers; use Law (Police) for the legal protocols. Police Rank determines relative standing. 

Servant: Knowledge of how to serve the upper class. Certain procedures are always done just so (the salad fork goes outside the dinner fork, the Duke is announced before the Earl, etc.), and certain attitudes in a servant are unacceptable. 

Savoir-Faire (High Society) is the most common specialty, and you may list this as simply “Savoir-Faire” on your character sheet. Savoir Faire (High Society) and (Servant) default to one another at -2. There are no defaults between other types of Savoir-Faire. ",IQ-4 and others. ,Easy,Intelligence,"Cultural Familiarity modifiers (p. 23). +2 if you are of higher standing than those you are trying to impress, or -2 if you are of lower standing (“standing” might mean Rank, Status, skill level, or something else). +2 if you seem to have important friends. -4 for Clueless (p. 126); -3 for Low Empathy (p. 142); -1 for Oblivious (p. 146); -1 to -4 for Shyness (p. 154)."
Scrounging,,,"This is the ability to find, salvage, or improvise useful items that others can’t locate. Each attempt takes an hour. You do not necessarily steal your booty; you just locate it – somehow – and then acquire it by any means necessary. Note that if you find something that is “nailed down,” you must decide how to try to get it (which might require a roll on another skill). ",Perception-4,Easy,Perception,"As the GM sees fit, for the rarity of the item sought."
Scuba,,,"This is the ability to use self-contained underwater breathing apparatus (scuba). Roll when you first enter the water, and again every 30 minutes thereafter, to avoid inhaling water (treat as drowning; see Suffocation, p. 436). If you know this skill above default level, a successful roll also lets you spot problems with the equipment before you put it on. ",IQ-5 or Diving Suit-2. Prerequisite: Swimming. ,Average,Intelligence,"-2 to -4 for unfamiliar scuba rigs; e.g., closed-circuit gear when you’re used to open-circuit."
Seamanship,TRUE,,"The skill of operating anchors, hatches, mooring lines, pumps, sails, windlasses, etc. aboard a large surface ship (but not a submarine). 

This is the ability to serve as crew aboard a specific type of large vehicle. It includes familiarity with “shipboard life,” knowledge of safety measures, and training in damage control (the use of emergency equipment to control flooding, fight fires, patch the hull, and so forth). Make a skill roll for basic map or chart reading, practical meteorology, or to recall laws and regulations that pertain to your vehicle. 

This skill also lets you steer the vessel. It is easier than Piloting, Submarine, and similar skills because it only includes knowledge of how to steer. Specialists handle such activities as plotting courses and operating sensors. These experts report to the captain, who in turn tells you how to maneuver. Make a DX-based skill roll whenever you take the helm – but note that your effective skill cannot exceed your captain’s Shiphandling skill (p. 220). 

The average Crewman skill of an entire crew can be used as a measure of overall crew quality. The GM rolls against average skill whenever the vehicle arrives or departs, in unfavorable conditions, or in battle. Failure and critical failure results depend on the circumstances. ",IQ-4,Easy,Intelligence,
Search,,,"This is the ability to search people, baggage, and vehicles for items that aren’t in plain sight. The GM rolls once – in secret – per item of interest. For deliberately concealed items, this is a Quick Contest of your Search skill vs. the Holdout or Smuggling skill used to hide the item. If you fail, the GM simply says, “You found nothing.” (It defeats the purpose to say, “You don’t find the gun under his jacket.”) 

If more than one person is searching, roll separately for each searcher. 

The GM should avoid unnecessary rolls. For instance, no human can get a sawed-off shotgun through a body search. Likewise, a knife or jewel simply cannot be found on a normally dressed person without an X-ray or skin search. In general, if the net bonus to the concealer’s Holdout roll is +3 or more, a skin search is required. If his Holdout is at -2 or worse for size, a skin search will automatically find the hidden item. ",Perception-5 or Criminology-5.,Average,Perception,"+1 for a “pat-down” of an unresisting person (takes one minute), +3 for a thorough “skin search” of a person’s hair and clothing (takes three minutes), or +5 for a complete search, including body cavities (takes five minutes). Bonuses for Acute Touch (p. 35) and Sensitive Touch (p. 83) apply to all hands-on searches. On a successful Electronics Operation (Security) roll, specialized sensors – metal detectors, X-ray machines, etc. – give from +1 to +5 to find items they can detect (a metal detector won’t help you find plastic explosives!)."
Sewing,TRUE,,"This is the ability to work with fabric using the tools of your tech level. A successful skill roll lets you repair damaged clothing (or any other item made of cloth), modify garments (useful when you must wear another person’s clothing, perhaps to impersonate him), or create new clothing or costumes from suitable materials. 

Make an IQ-based roll to design clothing, at +1 if you have Fashion Sense (p. 21). 

Before TL7, someone knows this skill in almost every household. At TL7+, it is rare for anyone but a professional seamstress or tailor to know Sewing – most people work at default (at +4 for a simple task like reattaching a button) and discard items that they cannot mend. ",DX-4,Easy,Dexterity,Equipment modifiers (p. 345); modifiers for High Manual Dexterity (p. 59) or Ham-Fisted (p. 138).
Sex Appeal,,,"This is the ability to impress those who are attracted to members of your sex. It has as much to do with attitude as it does with looks. If you are not willing to “vamp” someone to get what you want, you won’t have this skill – or want it. 

You may substitute an Influence roll against Sex Appeal for any reaction roll made by someone who is attracted to members of your sex; see Influence Rolls (p. 359). 

Usually, you may make only one attempt per “target,” although the GM might allow another attempt after a few weeks. ",HT-3,Average,Health,+2 for Voice (p. 97); -3 for Low Empathy (p. 142); -1 for Oblivious (p. 146); -1 to -4 for Shyness (p. 154); -2 for Stuttering (p. 157). Apply any bonus for above-average appearance (p. 21) – or double the penalty for below-average appearance!
Shadowing,,,"This is the ability to follow another person through a crowd without being noticed. (In the wilderness, use Tracking and Stealth.) Roll a Quick Contest every 10 minutes: your Shadowing vs. the subject’s Vision roll. If you lose, you lost the subject; if you lose by more than 5, you were seen. 

Once the subject is aware you are shadowing him, roll a Quick Contest every five minutes: your Shadowing skill vs. his Shadowing or Stealth skill. If he wins, he eludes you. If he loses by more than 5, he thinks he eluded you. If you critically fail, you lose him and follow the wrong person. 

Following someone in a vehicle is harder than shadowing on foot. Use the same rules, but you roll at -2 (and may not use your Stealth default). ","IQ-5, Observation-5, or Stealth-4 (on foot only). ",Average,Intelligence,"-3 if the subject knows you. Distinctive appearance gives a penalty – see Build (p. 18), Unnatural Features (p. 22), and specific disadvantages (e.g., Hunchback, p. 139) for details. If you belong to a visibly different race than most of the people around you, the penalty is up to the GM; it is never smaller in magnitude than the difference between your Size Modifier and that of those around you."
Shield,,TRUE,"This is the ability to use a shield, both to block and to attack. Your active defense with any kind of shield – your Block score – is (skill/2) + 3, rounded down. You must specialize: 

Shield: Any shield held in place with straps. Such shields have the advantage that you can hold (but not wield) something in your shield hand, but the disadvantage of being slow to put on or take off. This is the most common specialty – list it as “Shield” on character sheets. 

Buckler: Any kind of shield, usually a small one, held in the hand. A buckler occupies one hand completely, but you can ready it in only one turn and drop it as a free action. 

Force: Any shield with a blocking “surface” formed from energy rather than matter. 

Shield, Shield (Buckler), and Shield (Force) default to one another at -2.",DX-4,Easy,Dexterity,
Shiphandling,TRUE,TRUE,"This is the ability to act as the master of a large vessel. It involves directing the crew in the tasks necessary to control the vehicle’s speed and direction. It also covers such duties as keeping the captain’s log and inspecting the crew. Someone with Shiphandling skill (at better than default!) should stand watch at all times when the vessel is underway. Roll vs. skill when encountering hazards or maneuvering for battle. 

A failed roll when encountering hazards means the vessel is damaged. This might mean anything from scratched paint to crippling damage that requires extensive repairs. 

A failed roll in battle means the vessel did not go exactly where intended. The details depend on the vessel, the tech level, and the GM’s judgment, but might include weapons being “masked” (unable to engage the enemy), a failed boarding attempt, or drifting out of formation with your fleet (which might deny you the benefits of area defenses, fire support, or tactical communications). A critical failure under any circumstances means an appropriate disaster. Depending on the TL and situation, this could mean running aground, colliding with another vessel, being dismasted, losing your screws or rudder, or simply giving an order that your crew disregards. Whether they then save your ship for you, or mutiny and flee, is up to the GM. 

You must specialize: 

Airship: Blimps, zeppelins, and similar large airships. Prerequisites: Airshipman, Leadership, and Navigation (Air). Defaults: Airshipman-5 or Piloting (Lighter-Than-Air)-5. 

Ship: Surface vessels, from tugboats to carriers. Prerequisites: Leadership, Navigation (Sea), and Seamanship. Defaults: Seamanship-5, or to Boating (Large Powerboat)-5 for ships with engines or Boating (Sailboat)-5 for tall ships. 

Spaceship: Slower-than-light spacecraft. Prerequisites: Leadership, Navigation (Space), and Spacer. Defaults: Spacer-5 or any spaceship Piloting-5. 

Starship: Faster-than-light spacecraft. Prerequisites: Leadership, Navigation (Hyperspace), and Spacer. Defaults: Spacer-5 or any spaceship Piloting-5. 

Submarine: All forms of large submersibles. Prerequisites: Leadership, Navigation (Sea), and Submariner. Defaults: Submariner-5 or Submarine (Large Sub)-5. ",IQ-6 and others. Prerequisites: Description. ,Hard,Intelligence,"-2 to master an unfamiliar vessel (e.g., an aircraft carrier when you’re used to a battleship); -2 for an unfamiliar crew; -2 or more for a vehicle in bad repair."
Shortsword,,,"Any balanced, one-handed weapon 1-2 feet in length – including the shortsword and any club of comparable size and balance (e.g., a police baton). 

A sword is a rigid, hilted blade with a thrusting point, cutting edge, or both. All swords are balanced, and can attack and parry without becoming unready.  ","DX-5, Broadsword-2, Force Sword-4, Jitte/Sai-3, Knife-4, Saber-4, Smallsword-4, or Tonfa-3.",Average,Dexterity,
Singing,,,This is the ability to sing in a pleasing fashion. A successful roll means the audience liked your song. ,HT-4,Easy,Health,"Language Modifiers (p. 24), if you are singing in a foreign language; -2 if the audience does not understand the language; +2 for Voice (p. 97); -2 for Stuttering (p. 157)."
